{
  "contract": "q-shield-atlas-results/1",
  "label": "Q-Shield Atlas pipeline results",
  "generated_at": "2026-10-28T19:06:21.007739Z",
  "detection": {
    "static_status": "COMPLETED",
    "static_findings": [
      {
        "asset_id": "repo-auth-service",
        "domain": "auth-service",
        "key_type": "RSA",
        "key_size": 2048,
        "evidence": [
          {
            "file": "auth-service/app.py",
            "line": 1,
            "match": "from cryptography.hazmat.primitives.asymmetric import rsa",
            "key_type": "RSA",
            "key_size": 2048
          },
          {
            "file": "auth-service/app.py",
            "line": 3,
            "match": "AUTH_KEY = rsa.generate_private_key(public_exponent=65537, key_size=2048)",
            "key_type": "RSA",
            "key_size": 2048
          },
          {
            "file": "auth-service/certificates/server.crt",
            "line": 2,
            "match": "Public Key Algorithm: rsaEncryption",
            "key_type": "RSA",
            "key_size": 2048
          },
          {
            "file": "auth-service/tls.yaml",
            "line": 2,
            "match": "key_type: RSA",
            "key_type": "RSA",
            "key_size": 2048
          }
        ],
        "cipher_suites": [
          "TLS_AES_128_GCM_SHA256"
        ]
      },
      {
        "asset_id": "repo-payments-service",
        "domain": "payments-service",
        "key_type": "ECDSA",
        "key_size": 256,
        "evidence": [
          {
            "file": "payments-service/client.go",
            "line": 3,
            "match": "const signingAlgorithm = \"ECDSA\"",
            "key_type": "ECDSA",
            "key_size": null
          },
          {
            "file": "payments-service/service.toml",
            "line": 2,
            "match": "key_type = \"ECDSA\"",
            "key_type": "ECDSA",
            "key_size": 256
          }
        ],
        "cipher_suites": [
          "TLS_AES_256_GCM_SHA384"
        ]
      }
    ],
    "live_status": "COMPLETED",
    "live_observations": [
      {
        "host": "127.0.0.1",
        "port": 65334,
        "key_type": "RSA",
        "key_size": 2048,
        "cipher_suite": "TLS_AES_256_GCM_SHA384",
        "tls_version": "TLSv1.3"
      }
    ],
    "drifts": [
      {
        "asset_id": "repo-auth-service",
        "mismatches": [
          "cipher_suite: configured=TLS_AES_128_GCM_SHA256, negotiated=TLS_AES_256_GCM_SHA384"
        ]
      }
    ]
  },
  "asset_inventory": {
    "status": "COMPLETED",
    "assets": [
      {
        "asset_id": "asset-000",
        "domain": "auth.bank.internal",
        "key_type": "RSA",
        "key_size": 2048,
        "tls_version": "TLSv1.2",
        "shelf_life_years": 3.0,
        "effort_weeks": 2.0,
        "risk_weight": 7.0,
        "vulnerable": true,
        "dependencies": [],
        "evidence": [],
        "cipher_suites": [],
        "remaining_exposure_years": 0.0,
        "migration_status": "MIGRATED",
        "migrated": true
      },
      {
        "asset_id": "asset-001",
        "domain": "payments.bank.internal",
        "key_type": "ECDSA",
        "key_size": 256,
        "tls_version": "TLSv1.2",
        "shelf_life_years": 3.0,
        "effort_weeks": 2.0,
        "risk_weight": 9.5,
        "vulnerable": true,
        "dependencies": [],
        "evidence": [],
        "cipher_suites": [],
        "remaining_exposure_years": 0.0,
        "migration_status": "MIGRATED",
        "migrated": true
      },
      {
        "asset_id": "asset-002",
        "domain": "crypto.bank.internal",
        "key_type": "RSA",
        "key_size": 1024,
        "tls_version": "TLSv1.1",
        "shelf_life_years": 3.0,
        "effort_weeks": 2.0,
        "risk_weight": 9.5,
        "vulnerable": true,
        "dependencies": [],
        "evidence": [],
        "cipher_suites": [],
        "remaining_exposure_years": 0.0,
        "migration_status": "MIGRATED",
        "migrated": true
      },
      {
        "asset_id": "asset-003",
        "domain": "api.bank.internal",
        "key_type": "ML-KEM",
        "key_size": 768,
        "tls_version": "TLSv1.3",
        "shelf_life_years": 10.0,
        "effort_weeks": 2.0,
        "risk_weight": 9.5,
        "vulnerable": false,
        "dependencies": [],
        "evidence": [],
        "cipher_suites": [],
        "remaining_exposure_years": 10.0,
        "migration_status": "LEGACY",
        "migrated": false
      },
      {
        "asset_id": "repo-auth-service",
        "domain": "auth-service",
        "key_type": "RSA",
        "key_size": 2048,
        "tls_version": "TLSv1.2",
        "shelf_life_years": 3.0,
        "effort_weeks": 2.0,
        "risk_weight": 7.0,
        "vulnerable": true,
        "dependencies": [],
        "evidence": [
          {
            "file": "auth-service/app.py",
            "line": 1,
            "match": "from cryptography.hazmat.primitives.asymmetric import rsa",
            "key_type": "RSA",
            "key_size": 2048
          },
          {
            "file": "auth-service/app.py",
            "line": 3,
            "match": "AUTH_KEY = rsa.generate_private_key(public_exponent=65537, key_size=2048)",
            "key_type": "RSA",
            "key_size": 2048
          },
          {
            "file": "auth-service/certificates/server.crt",
            "line": 2,
            "match": "Public Key Algorithm: rsaEncryption",
            "key_type": "RSA",
            "key_size": 2048
          },
          {
            "file": "auth-service/tls.yaml",
            "line": 2,
            "match": "key_type: RSA",
            "key_type": "RSA",
            "key_size": 2048
          }
        ],
        "cipher_suites": [
          "TLS_AES_128_GCM_SHA256"
        ],
        "remaining_exposure_years": 0.0,
        "migration_status": "MIGRATED",
        "migrated": true
      },
      {
        "asset_id": "repo-payments-service",
        "domain": "payments-service",
        "key_type": "ECDSA",
        "key_size": 256,
        "tls_version": "TLSv1.2",
        "shelf_life_years": 3.0,
        "effort_weeks": 2.0,
        "risk_weight": 9.5,
        "vulnerable": true,
        "dependencies": [],
        "evidence": [
          {
            "file": "payments-service/client.go",
            "line": 3,
            "match": "const signingAlgorithm = \"ECDSA\"",
            "key_type": "ECDSA",
            "key_size": null
          },
          {
            "file": "payments-service/service.toml",
            "line": 2,
            "match": "key_type = \"ECDSA\"",
            "key_type": "ECDSA",
            "key_size": 256
          }
        ],
        "cipher_suites": [
          "TLS_AES_256_GCM_SHA384"
        ],
        "remaining_exposure_years": 0.0,
        "migration_status": "MIGRATED",
        "migrated": true
      },
      {
        "asset_id": "toy-legacy-service",
        "domain": "toy-legacy-service",
        "key_type": "RSA",
        "key_size": 64,
        "tls_version": "synthetic-toy",
        "shelf_life_years": 3.0,
        "effort_weeks": 1.0,
        "risk_weight": 9.5,
        "vulnerable": true,
        "dependencies": [],
        "remaining_exposure_years": 0.0,
        "migration_status": "MIGRATED",
        "migrated": true
      }
    ]
  },
  "schedule": {
    "status": "COMPLETED",
    "provider": "SciPy HiGHS local fallback (same QpiAI MILP matrix)",
    "optimized": {
      "objective": 19.846153846153847,
      "schedule": [
        {
          "asset_id": "asset-003",
          "start_week": 0,
          "completion_week": 2,
          "completion_year": 2026.0384615384614,
          "scenario_exposure_years": {
            "2030": 0.038461538461538464,
            "2032": 0.038461538461538464,
            "2035": 0.038461538461538464
          },
          "weighted_exposure_years": 1.0961538461538463
        },
        {
          "asset_id": "asset-001",
          "start_week": 2,
          "completion_week": 4,
          "completion_year": 2026.076923076923,
          "scenario_exposure_years": {
            "2030": 0.07692307692307693,
            "2032": 0.07692307692307693,
            "2035": 0.07692307692307693
          },
          "weighted_exposure_years": 2.1923076923076925
        },
        {
          "asset_id": "asset-002",
          "start_week": 4,
          "completion_week": 6,
          "completion_year": 2026.1153846153845,
          "scenario_exposure_years": {
            "2030": 0.11538461538461539,
            "2032": 0.11538461538461539,
            "2035": 0.11538461538461539
          },
          "weighted_exposure_years": 3.2884615384615383
        },
        {
          "asset_id": "repo-payments-service",
          "start_week": 6,
          "completion_week": 8,
          "completion_year": 2026.1538461538462,
          "scenario_exposure_years": {
            "2030": 0.15384615384615385,
            "2032": 0.15384615384615385,
            "2035": 0.15384615384615385
          },
          "weighted_exposure_years": 4.384615384615385
        },
        {
          "asset_id": "repo-auth-service",
          "start_week": 8,
          "completion_week": 10,
          "completion_year": 2026.1923076923076,
          "scenario_exposure_years": {
            "2030": 0.19230769230769232,
            "2032": 0.19230769230769232,
            "2035": 0.19230769230769232
          },
          "weighted_exposure_years": 4.038461538461539
        },
        {
          "asset_id": "asset-000",
          "start_week": 10,
          "completion_week": 12,
          "completion_year": 2026.2307692307693,
          "scenario_exposure_years": {
            "2030": 0.23076923076923078,
            "2032": 0.23076923076923078,
            "2035": 0.23076923076923078
          },
          "weighted_exposure_years": 4.846153846153846
        }
      ]
    },